{
  "issue_number": 42,
  "issue_url": "https://github.com/unbound-force/unbound-force/issues/42",
  "repo": "unbound-force/unbound-force",
  "title": "Gateway proxy panics on nil response body",
  "author": "contributor-alice",
  "category": "bug",
  "validity": "valid",
  "objectivity": "objective",
  "duplicate_of": null,
  "split_issues": [],
  "assessments": [
    {
      "agent": "divisor-adversary",
      "verdict": "valid",
      "category": "bug",
      "objectivity": "objective",
      "reasoning": "Nil pointer dereference on response body is a crash-level defect. The proxy does not check for nil before reading.",
      "split_recommendation": null
    },
    {
      "agent": "divisor-architect",
      "verdict": "valid",
      "category": "bug",
      "objectivity": "objective",
      "reasoning": "The nil check is missing in the proxy handler. This violates the error handling convention (CS-006) which requires checking all return values.",
      "split_recommendation": null
    },
    {
      "agent": "divisor-guard",
      "verdict": "invalid",
      "category": "opinion",
      "objectivity": "subjective",
      "reasoning": "The reporter expects the proxy to handle upstream failures gracefully, but the current design intentionally surfaces upstream errors. This is a design philosophy difference.",
      "split_recommendation": null
    },
    {
      "agent": "divisor-sre",
      "verdict": "valid",
      "category": "bug",
      "objectivity": "objective",
      "reasoning": "A panic in production crashes the process without cleanup. This is an operational reliability issue regardless of design intent.",
      "split_recommendation": null
    },
    {
      "agent": "divisor-testing",
      "verdict": "valid",
      "category": "bug",
      "objectivity": "objective",
      "reasoning": "No test covers the nil response body path. This is a test coverage gap that allowed a crash-level defect to ship.",
      "split_recommendation": null
    }
  ],
  "actions_taken": {
    "labels_applied": ["bug"],
    "comment_posted": true,
    "child_issues_created": [],
    "label_creation_failed": false
  },
  "summary": {
    "agents_consulted": 5,
    "agents_available": 5,
    "consensus": "4/5 valid",
    "dissenting_agents": [
      {
        "agent": "divisor-guard",
        "reasoning": "Considers this a design philosophy difference rather than a defect"
      }
    ]
  }
}
